{
  "assetCount": 90,
  "assets": [
    {
      "byteSize": 159404,
      "category": "bottle-schema",
      "developmentDependencies": [],
      "externalRefs": [],
      "gitBlobOid": "2e407d86a9f1002fa4d6f8d25eaa0179ed5a4429",
      "gitMode": "100644",
      "intendedOwner": "compatforge/bottle-schema",
      "kind": "bottle-schema",
      "license": {
        "status": "unresolved"
      },
      "objectPath": "objects/sha256/5f/79745e5262c57b8482b5a35b8a65985a87bb357d35e679a93ee0a6924aad56",
      "provenance": {
        "status": "unresolved"
      },
      "sha256": "5f79745e5262c57b8482b5a35b8a65985a87bb357d35e679a93ee0a6924aad56",
      "sourceCommit": "db12d5ebc5ba0d5a29c9464d07c1a86ffbc47527",
      "sourcePath": "MacWinManager/Sources/MacWinCore/BottleService.swift"
    },
    {
      "byteSize": 1977,
      "category": "bottle-schema",
      "developmentDependencies": [],
      "externalRefs": [],
      "gitBlobOid": "07d504af98ce0b23864677bdb9180d68f6b282bb",
      "gitMode": "100644",
      "intendedOwner": "compatforge/bottle-schema",
      "kind": "bottle-schema",
      "license": {
        "status": "unresolved"
      },
      "objectPath": "objects/sha256/af/72b14b83029129e85a94d4686fd04efab04575cedc6ae281a5877275b585a2",
      "provenance": {
        "status": "unresolved"
      },
      "sha256": "af72b14b83029129e85a94d4686fd04efab04575cedc6ae281a5877275b585a2",
      "sourceCommit": "db12d5ebc5ba0d5a29c9464d07c1a86ffbc47527",
      "sourcePath": "MacWinManager/Sources/MacWinCore/JSONStore.swift"
    },
    {
      "byteSize": 2293,
      "category": "bottle-schema",
      "developmentDependencies": [],
      "externalRefs": [],
      "gitBlobOid": "6f9c981674dd7573b18252710a99f24ee787f8e2",
      "gitMode": "100644",
      "intendedOwner": "compatforge/bottle-schema",
      "kind": "bottle-schema",
      "license": {
        "status": "unresolved"
      },
      "objectPath": "objects/sha256/2f/87cd2508537b4f8d128ea118b0fdbaf880613832645713e89756c8003b9615",
      "provenance": {
        "status": "unresolved"
      },
      "sha256": "2f87cd2508537b4f8d128ea118b0fdbaf880613832645713e89756c8003b9615",
      "sourceCommit": "db12d5ebc5ba0d5a29c9464d07c1a86ffbc47527",
      "sourcePath": "MacWinManager/Sources/MacWinCore/MacWinPaths.swift"
    },
    {
      "byteSize": 13866,
      "category": "bottle-schema",
      "developmentDependencies": [],
      "externalRefs": [],
      "gitBlobOid": "79ab686ff80b393c119ede72d071c5aa74183721",
      "gitMode": "100644",
      "intendedOwner": "compatforge/bottle-schema",
      "kind": "bottle-schema",
      "license": {
        "status": "unresolved"
      },
      "objectPath": "objects/sha256/8c/0cb0cdacaa83f99e6c5f41af3da3596f7a578edfcec052c2976ba75e9f4b6e",
      "provenance": {
        "status": "unresolved"
      },
      "sha256": "8c0cb0cdacaa83f99e6c5f41af3da3596f7a578edfcec052c2976ba75e9f4b6e",
      "sourceCommit": "db12d5ebc5ba0d5a29c9464d07c1a86ffbc47527",
      "sourcePath": "MacWinManager/Sources/MacWinCore/Models.swift"
    },
    {
      "byteSize": 3549,
      "category": "catalog",
      "developmentDependencies": [],
      "externalRefs": [],
      "gitBlobOid": "b511a1a3db1956452acbd8da9cae56be118fbc82",
      "gitMode": "100644",
      "intendedOwner": "compatforge/catalog",
      "kind": "catalog-record",
      "license": {
        "status": "unresolved"
      },
      "objectPath": "objects/sha256/2c/8bb75c7b294f6e75f45e08fb4b1e2050df0aa6260d96ccca50790e7229aa5c",
      "provenance": {
        "status": "unresolved"
      },
      "sha256": "2c8bb75c7b294f6e75f45e08fb4b1e2050df0aa6260d96ccca50790e7229aa5c",
      "sourceCommit": "db12d5ebc5ba0d5a29c9464d07c1a86ffbc47527",
      "sourcePath": "MacWinManager/Sources/MacWinManagerApp/Resources/Catalog/catalog.index.json"
    },
    {
      "byteSize": 194,
      "category": "catalog",
      "developmentDependencies": [],
      "externalRefs": [],
      "gitBlobOid": "c324caa1f0774cb4fc8827bb25360c6b06c7d66f",
      "gitMode": "100644",
      "intendedOwner": "compatforge/catalog",
      "kind": "catalog-record",
      "license": {
        "status": "unresolved"
      },
      "objectPath": "objects/sha256/8e/34669b99d0c09b610ad79f0ed763699115fa57769f691e641ef6812c46e966",
      "provenance": {
        "status": "unresolved"
      },
      "sha256": "8e34669b99d0c09b610ad79f0ed763699115fa57769f691e641ef6812c46e966",
      "sourceCommit": "db12d5ebc5ba0d5a29c9464d07c1a86ffbc47527",
      "sourcePath": "MacWinManager/Sources/MacWinManagerApp/Resources/Catalog/catalog.signature.json"
    },
    {
      "byteSize": 1037,
      "category": "catalog",
      "developmentDependencies": [],
      "externalRefs": [
        "https://www.7-zip.org/a/7z2601-x64.exe"
      ],
      "gitBlobOid": "a7d1bf1233c4aeb558465d6441da85ebd25f7b7b",
      "gitMode": "100644",
      "intendedOwner": "compatforge/catalog",
      "kind": "catalog-record",
      "license": {
        "status": "unresolved"
      },
      "objectPath": "objects/sha256/fb/320ed41e101182af879de445fca01f035a5aebea910683fe27a5b56805d55e",
      "provenance": {
        "status": "unresolved"
      },
      "sha256": "fb320ed41e101182af879de445fca01f035a5aebea910683fe27a5b56805d55e",
      "sourceCommit": "db12d5ebc5ba0d5a29c9464d07c1a86ffbc47527",
      "sourcePath": "MacWinManager/Sources/MacWinManagerApp/Resources/Catalog/recipes/7zip.json"
    },
    {
      "byteSize": 1425,
      "category": "catalog",
      "developmentDependencies": [],
      "externalRefs": [
        "https://download.mozilla.org/?product=firefox-msi-latest-ssl&os=win64&lang=zh-CN"
      ],
      "gitBlobOid": "d39cdc9244ac066b1eaddcc3212b5329eafcd7bf",
      "gitMode": "100644",
      "intendedOwner": "compatforge/catalog",
      "kind": "catalog-record",
      "license": {
        "status": "unresolved"
      },
      "objectPath": "objects/sha256/50/17cecb5c77738b1866016659a0357e2fa2e8efa093f6aeeae62a63c6e2c119",
      "provenance": {
        "status": "unresolved"
      },
      "sha256": "5017cecb5c77738b1866016659a0357e2fa2e8efa093f6aeeae62a63c6e2c119",
      "sourceCommit": "db12d5ebc5ba0d5a29c9464d07c1a86ffbc47527",
      "sourcePath": "MacWinManager/Sources/MacWinManagerApp/Resources/Catalog/recipes/firefox.json"
    },
    {
      "byteSize": 1176,
      "category": "catalog",
      "developmentDependencies": [
        "/Users/a1-6/project/Mac-Win/refs/prefixes/hoyoplay-x86_64/drive_c/Program Files/miHoYo Launcher/1.16.1.364/HYP.exe"
      ],
      "externalRefs": [],
      "gitBlobOid": "603395aaa53f7123def947e09254c6d074b2b220",
      "gitMode": "100644",
      "intendedOwner": "compatforge/catalog",
      "kind": "catalog-record",
      "license": {
        "status": "unresolved"
      },
      "objectPath": "objects/sha256/2c/66c2001d3ad679a8df292172bc950db7f259a723dfce23ee7ed3035ccfd6f7",
      "provenance": {
        "status": "unresolved"
      },
      "sha256": "2c66c2001d3ad679a8df292172bc950db7f259a723dfce23ee7ed3035ccfd6f7",
      "sourceCommit": "db12d5ebc5ba0d5a29c9464d07c1a86ffbc47527",
      "sourcePath": "MacWinManager/Sources/MacWinManagerApp/Resources/Catalog/recipes/hoyoplay-cn.json"
    },
    {
      "byteSize": 2275,
      "category": "catalog",
      "developmentDependencies": [],
      "externalRefs": [
        "https://github.com/jasp-stats/jasp-desktop/releases/download/v0.97.1/JASP-0.97.1-Windows-Community.msi"
      ],
      "gitBlobOid": "3eab746e4ced6d3ba952448d3bb60b525bd8a0ed",
      "gitMode": "100644",
      "intendedOwner": "compatforge/catalog",
      "kind": "catalog-record",
      "license": {
        "status": "unresolved"
      },
      "objectPath": "objects/sha256/eb/af01b7de53da849c9aa45e3c87f24e6c8e69ef3f742ca5eaedd6a0f8c79dd4",
      "provenance": {
        "status": "unresolved"
      },
      "sha256": "ebaf01b7de53da849c9aa45e3c87f24e6c8e69ef3f742ca5eaedd6a0f8c79dd4",
      "sourceCommit": "db12d5ebc5ba0d5a29c9464d07c1a86ffbc47527",
      "sourcePath": "MacWinManager/Sources/MacWinManagerApp/Resources/Catalog/recipes/jasp-stats.json"
    },
    {
      "byteSize": 1351,
      "category": "catalog",
      "developmentDependencies": [],
      "externalRefs": [],
      "gitBlobOid": "ecea4ef85c95c60e1e555ac37a536fa4d6f7b742",
      "gitMode": "100644",
      "intendedOwner": "compatforge/catalog",
      "kind": "catalog-record",
      "license": {
        "status": "unresolved"
      },
      "objectPath": "objects/sha256/37/c2abfd4fe1fd1d6e0ee85a79592112c0f85a7d1eb452375617b8bee874b10e",
      "provenance": {
        "status": "unresolved"
      },
      "sha256": "37c2abfd4fe1fd1d6e0ee85a79592112c0f85a7d1eb452375617b8bee874b10e",
      "sourceCommit": "db12d5ebc5ba0d5a29c9464d07c1a86ffbc47527",
      "sourcePath": "MacWinManager/Sources/MacWinManagerApp/Resources/Catalog/recipes/lenovo-app-store.json"
    },
    {
      "byteSize": 2109,
      "category": "catalog",
      "developmentDependencies": [],
      "externalRefs": [
        "https://download.documentfoundation.org/libreoffice/stable/26.2.4/win/x86_64/LibreOffice_26.2.4_Win_x86-64.msi"
      ],
      "gitBlobOid": "29b30b7c1bfb24602987d461ecd086063a644662",
      "gitMode": "100644",
      "intendedOwner": "compatforge/catalog",
      "kind": "catalog-record",
      "license": {
        "status": "unresolved"
      },
      "objectPath": "objects/sha256/60/b8de3c52df0380b039ae07e608c494a63f69d0483195bc4471afcb5384ff12",
      "provenance": {
        "status": "unresolved"
      },
      "sha256": "60b8de3c52df0380b039ae07e608c494a63f69d0483195bc4471afcb5384ff12",
      "sourceCommit": "db12d5ebc5ba0d5a29c9464d07c1a86ffbc47527",
      "sourcePath": "MacWinManager/Sources/MacWinManagerApp/Resources/Catalog/recipes/libreoffice.json"
    },
    {
      "byteSize": 1349,
      "category": "catalog",
      "developmentDependencies": [],
      "externalRefs": [
        "https://ltspice.analog.com/software/LTspice64.msi"
      ],